{
  "contract_version": "1.0.0",
  "working_title": "Prepare a safe WordPress draft with an editorial agent",
  "canonical_slug": "prepare-safe-wordpress-draft",
  "content_format": "practical-guide",
  "primary_topic": "build",
  "primary_audience": "builder",
  "user_question": "How can an editorial agent prepare a WordPress draft safely?",
  "direct_answer": "Validate accepted inputs, use draft-only permissions, and stop before publication.",
  "search_intent": "procedural",
  "unique_value_type": "implementation-procedure",
  "unique_value": "A reproducible draft-only workflow with explicit rollback and handoff gates.",
  "public_entities": ["WordPress", "MCPWP"],
  "canonical_page_supported": null,
  "required_evidence": ["Authorized WordPress operations", "Draft rollback behavior"],
  "primary_sources": ["https://developer.wordpress.org/rest-api/reference/posts/"],
  "test_required": true,
  "versions_and_date": "WordPress 6.8 and MCPWP 3.6.1, tested 2026-07-19",
  "required_internal_links": ["/wordpress-ai/"],
  "human_reviewer_role": "editor",
  "ai_disclosure": "AI assisted with research and drafting; a human editor reviews publication.",
  "freshness_class": "version-sensitive",
  "update_trigger": "WordPress post status or MCPWP authorization behavior changes.",
  "commercial_relationship": "none"
}
