{
  "contract_version": "1.0.0",
  "working_title": "How bounded editorial agents prepare WordPress drafts",
  "canonical_slug": "bounded-editorial-agents",
  "content_format": "explainer",
  "primary_topic": "understand",
  "primary_audience": "content-team",
  "user_question": "How do bounded editorial agents prepare WordPress drafts safely?",
  "direct_answer": "They use explicit roles, evidence gates, and human-controlled publication transitions.",
  "search_intent": "informational",
  "unique_value_type": "primary-source-synthesis",
  "unique_value": "A contract-level explanation of role, evidence, and publication boundaries.",
  "public_entities": ["WordPress", "MCPWP"],
  "canonical_page_supported": null,
  "required_evidence": ["WordPress draft status behavior", "Editorial role boundaries"],
  "primary_sources": ["https://developer.wordpress.org/rest-api/reference/posts/"],
  "test_required": false,
  "versions_and_date": null,
  "required_internal_links": ["/wordpress-ai/"],
  "human_reviewer_role": "editor",
  "ai_disclosure": "AI assisted with research and drafting; a human editor reviews publication.",
  "freshness_class": "evergreen",
  "update_trigger": "The editorial role or publication policy changes.",
  "commercial_relationship": "none"
}
