{
  "contract_version": "1.0.0",
  "working_title": "Testing draft-only editorial agent permissions",
  "canonical_slug": "test-draft-only-agent-permissions",
  "content_format": "test-report",
  "primary_topic": "test",
  "primary_audience": "builder",
  "user_question": "Do draft-only editorial permissions prevent agent publication?",
  "direct_answer": "The test records whether allowed draft mutations succeed and publication attempts are blocked.",
  "search_intent": "evaluative",
  "unique_value_type": "original-test",
  "unique_value": "Dated, reproducible permission results with preserved failure artifacts.",
  "public_entities": ["WordPress", "MCPWP"],
  "canonical_page_supported": null,
  "required_evidence": ["Draft mutation test log", "Rejected publication test log"],
  "primary_sources": ["https://developer.wordpress.org/rest-api/reference/posts/"],
  "test_required": true,
  "versions_and_date": "WordPress 6.8 and MCPWP 3.6.1, tested 2026-07-19",
  "required_internal_links": ["/wordpress-ai/"],
  "human_reviewer_role": "technical editor",
  "ai_disclosure": "AI executed the bounded test sequence; a human technical editor reviews the evidence.",
  "freshness_class": "version-sensitive",
  "update_trigger": "WordPress or MCPWP permission behavior changes.",
  "commercial_relationship": "none"
}
