{
  "contract_version": "1.0.0",
  "working_title": "WordPress editorial automation update for July 2026",
  "canonical_slug": "wordpress-editorial-automation-july-2026",
  "content_format": "news-briefing",
  "primary_topic": "grow",
  "primary_audience": "site-owner",
  "user_question": "What changed in WordPress editorial automation this month?",
  "direct_answer": "The briefing explains the confirmed change, affected users, open questions, and safe next actions.",
  "search_intent": "informational",
  "unique_value_type": "primary-source-synthesis",
  "unique_value": "A dated interpretation connected to the durable WordPress automation page.",
  "public_entities": ["WordPress", "MCPWP"],
  "canonical_page_supported": "/wordpress-ai/",
  "required_evidence": ["Primary announcement", "Affected version and release date"],
  "primary_sources": ["https://wordpress.org/news/"],
  "test_required": false,
  "versions_and_date": "Reporting date 2026-07-19",
  "required_internal_links": ["/wordpress-ai/"],
  "human_reviewer_role": "news editor",
  "ai_disclosure": "AI assisted with source collection and drafting; a human editor reviews publication.",
  "freshness_class": "news",
  "update_trigger": "The primary announcement is corrected or implementation details change.",
  "commercial_relationship": "none"
}
