{
  "contract_version": "1.0.0",
  "working_title": "Comparing manual and agent-assisted WordPress drafting",
  "canonical_slug": "manual-vs-agent-wordpress-drafting",
  "content_format": "comparison-review",
  "primary_topic": "build",
  "primary_audience": "content-team",
  "user_question": "Should a content team use manual or agent-assisted WordPress drafting?",
  "direct_answer": "Choose based on evidence requirements, permission controls, review capacity, and workflow volume.",
  "search_intent": "comparative",
  "unique_value_type": "evidence-led-analysis",
  "unique_value": "A criterion-matched comparison grounded in the same publishing workflow.",
  "public_entities": ["WordPress", "MCPWP"],
  "canonical_page_supported": null,
  "required_evidence": ["Comparable workflow timings", "Permission and review requirements"],
  "primary_sources": ["https://developer.wordpress.org/rest-api/reference/posts/"],
  "test_required": true,
  "versions_and_date": "WordPress 6.8 and MCPWP 3.6.1, compared 2026-07-19",
  "required_internal_links": ["/wordpress-ai/"],
  "human_reviewer_role": "editor",
  "ai_disclosure": "AI assisted with evidence collection; a human editor reviews the comparison.",
  "freshness_class": "version-sensitive",
  "update_trigger": "Pricing, permissions, or workflow capabilities materially change.",
  "commercial_relationship": "none"
}
