{
  "contract_version": "1.0.0",
  "working_title": "Why editorial agents need narrow publication authority",
  "canonical_slug": "editorial-agents-narrow-authority",
  "content_format": "analysis-opinion",
  "primary_topic": "govern",
  "primary_audience": "content-team",
  "user_question": "Why should editorial agents have narrow publication authority?",
  "direct_answer": "Narrow authority keeps evidence, review, and irreversible publication decisions accountable.",
  "search_intent": "evaluative",
  "unique_value_type": "evidence-led-analysis",
  "unique_value": "An explicit thesis tested against the strongest automation counterargument.",
  "public_entities": ["WordPress", "MCPWP"],
  "canonical_page_supported": "/wordpress-ai/",
  "required_evidence": ["Publication permission boundaries", "Strongest automation counterargument"],
  "primary_sources": ["https://developer.wordpress.org/rest-api/reference/posts/"],
  "test_required": false,
  "versions_and_date": null,
  "required_internal_links": ["/wordpress-ai/"],
  "human_reviewer_role": "editorial director",
  "ai_disclosure": "AI assisted with research and drafting; the named human editor owns the opinion.",
  "freshness_class": "evergreen",
  "update_trigger": "Material evidence about safe autonomous publication changes.",
  "commercial_relationship": "none"
}
